{
  "schemaVersion": 1,
  "recordType": "evidence",
  "id": "evidence.binary.rule-0001-status-bubbles-683c721d",
  "kind": "binary",
  "buildId": "build.df.0.53.15-win64-steam-683c721d",
  "source": {
    "contentSha256": "683C721D1261E77FF862A2E01DFE3FF93D107AB7B1C92B5A3B6F313CCC8FC284",
    "privateLocator": "oracle://build/683C721D1261E77FF862A2E01DFE3FF93D107AB7B1C92B5A3B6F313CCC8FC284/executable"
  },
  "selectors": {
    "functionAddresses": ["0x1402685d0", "0x140ad93a0", "0x140e89460", "0x140e949e0", "0x140e94ac0"]
  },
  "producer": {
    "tool": "Ghidra OracleRefs, typed bulk corpus, and decompiler read",
    "version": "Ghidra 12.1.2; typed corpus 683c721d; Oracle scripts snapshot 2026-07-15"
  },
  "createdAt": "2026-07-15T17:51:41Z",
  "structuralValidation": {
    "passed": true,
    "method": "Executable hash and PE timestamp matched the DFHack symbol table. Caller tracing separates the normal graphics renderer and its UNIT_STATUS selector/writer from the timed non-graphics chooser; threshold fields were corroborated against the matching df-structures layout."
  }
}
